U74999MH2013PTC251274,THREE STAR PROTECTION FORCE INDIA PRIVATE LIMITED,Mumbai,Active,acc.ahdl@gmail.com
U74140DL2015PTC287487,WOOD EXOTICA VENTURES PRIVATE LIMITED,Delhi,Active,praneshgupta@hotmail.com
U31900UP2020PTC139271,ROAD HAWK PRIVATE LIMITED,Kanpur,Active,office203205@gmail.com
U72200KL2013PTC033223,EUROSIA BIM SERVICES PRIVATE LIMITED,Ernakulam,Active,ashitha.ajai@eurosia.eu
U90009TN2017PTC117683,GREEN ETHICS PRIVATE LIMITED,Chennai,Active,reachtogepl@gmail.com
U70109WB2010PTC154710,DEC INFRACON PRIVATE LIMITED,Kolkata,Active,goyalpankajforyou@gmail.com
U52609DL2017PTC318764,MONIQUE FURNITURE PRIVATE LIMITED,Delhi,Active,gstyoungteam@GMAIL.COM
U29304MH1992PTC068876,AIRPAC BIOAIRE SYSTEMS (INDIA) PRIVATE LIMITED,Mumbai,Strike Off,airpac@bom3.vsnl.net.in
U74999TN2016PTC110788,BERNAD STEPHEN LOGISTICS PRIVATE LIMITED,Chennai,Strike Off,corporate@rkfi.in
U74899DL1990PTC039157,S K RASAYAN UDYOG PVT LTD,Delhi,Active,radheys@gmail.com
U40101CT2008PTC020531,VIJAYAA FERRO AND POWER PRIVATE LIMITED,Chhattisgarh,Active,motilalsharmaladugaon@gmail.com
U70109DL2006PTC150387,VYOM INFRASTRUCTURES PRIVATE LIMITED,Delhi,Active,info@vyom.in
U74999DL2019PTC347088,OM BHIKSHU CREATION PRIVATE LIMITED,Delhi,Active,ombhikshucreation@gmail.com
U74210MH2001PTC134268,EVOLUTION ARCHITECTURAL DESIGN STUDIO PRIVATE LIMITED,Mumbai,Active,krishna.dalvi@gmail.com
U55204MH2019PTC319287,SUTANTU FOOD AND BEVERAGES PRIVATE LIMITED,Mumbai,Active,babitariponjain@gmail.com
U63030MH2020PTC349318,TROOPERS JUNCTION PRIVATE LIMITED,Mumbai,Active,gadkarradhika@gmail.com
U17120MH2011PTC218113,KESHI PEARL TEXTILES PRIVATE LIMITED,Mumbai,Active,keshipearltextilespvtltd@gmail.com
U45201DL2003PTC118680,S M BUILDWELL PRIVATE LIMITED,Delhi,Active,samir.aggarwal@samirikaexports.net
U85320WB2020NPL240944,GIVE SMILE FOUNDATION,Kolkata,Active,Siddhartha.jana137@gmail.com
U70109WB2012PTC175769,SWATIPUSHP HOUSING PRIVATE LIMITED,Kolkata,Strike Off,swatipushphousings15@yahoo.com
U51909DL2009PTC194466,SHREETA TRADEX PRIVATE LIMITED,Delhi,Active,shreetatradex@gmail.com
U15400OR2021PTC035561,GRAMBHOG AGRO PRIVATE LIMITED,Cuttack,Active,rakeshibat@gmail.com
U51909WB1961PTC025232,SHANTI STORES PVT LTD.,Kolkata,Strike Off,-
U24239TG1991PTC012661,PARAMESWARI PHARMACEUTICALS PRIVATE LIMITED,Hyderabad,Strike Off,-
U60212DL1993PTC053189,TALWAR ROADLINES PRIVATE LIMTED,Delhi,Strike Off,-
U45400CT2014PLC001248,JAYMAHALAXMI INFRADEV CONSTRUCTORS LIMITED,Chhattisgarh,Strike Off,toshanlal30@gmail.com
AAR-3805,LEXSHIELD FIRST LLP,Ahmedabad,Active,LEXSHIELDLLP@GMAIL.COM
U18100DL2011PTC214825,N.S. INTERNATIONAL PRIVATE LIMITED,Delhi,Active,accounts@nsexports.co.in
U70102UP2015PTC075279,AAHELI HOMES PRIVATE LIMITED,Kanpur,Active,sandeep3172@gmail.com
U70102WB2013PTC189911,RESUME PROJECTS PRIVATE LIMITED,Kolkata,Active,revertappartments@gmail.com
U17129KA2001PTC029586,LMF HOME TEXTILES PRIVATE LIMITED,Bangalore,Active,admin@sandh.in
U67120CT1989PLC005604,SHOBHA LANDS & HOUSING LTD.,Chhattisgarh,Strike Off,-
U74999MH2009PTC197147,PROJECT MASTER ELECTRICALS PRIVATE LIMITED,Mumbai,Active,MULTITRADE.CABLES@GMAIL.COM
U99999PY1996PTC001264,SRI KUBERAN BUILDER AND FINANCE (INDIA) PRIVATE LIMITED,Pondicherry,Strike Off,-
U15205GA2007PTC005435,AQUA ICE GOA PRIVATE LIMITED,Goa,Strike Off,amol@nueconindia.com
U17123GJ2014PTC081590,SAHAJANAND COTSPIN PRIVATE LIMITED,Ahmedabad,Active,sahajanandcotspin@gmail.com
ABA-7157,MAZA KTH ENTERPRISES LLP,Mumbai,Active,himtan1169@gmail.com
AAU-0348,BEAUBEES BEEKEEPING SERVICES LLP,Bangalore,Active,ranjithbage@gmail.com
U40107PN2018PTC176019,FIYSUN ENERGY PRIVATE LIMITED,Pune,Active,fiysunenergy@gmail.com
U51109WB2007PTC112451,SAFE COMMERCIAL PRIVATE LIMITED,Kolkata,Active,SAFECOMMERCIAL10@GMAIL.COM
U51909HR2018PTC075143,ENLASIA PHARMACEUTICALS PRIVATE LIMITED,Delhi,Active,RAKESHMITTAL69@GMAIL.COM
AAU-0881,SHAMMTECH IT SOLUTIONS LLP,Kanpur,Active,csirasrivastawa@gmail.com
U28121TN2016PTC103917,TRIOCON SPACE FRAME TECHNOLOGIES PRIVATE LIMITED,Chennai,Active,josephsunil2010@gmail.com
U51909MH2010PTC206425,ANWITA COMMERCIALS PRIVATE LIMITED,Mumbai,Active,dsplmca4@servicesnext.com
U01400MH2009PLC197486,TANCOM AGRICULTURAL LIMITED,Mumbai,Active,tancom.agri@tandongroup.com
U52100MH2021PTC355869,CARENETICS STORE PRIVATE LIMITED,Mumbai,Active,geodesic1234@gmail.com
U45200AP2004PTC044337,J.V. HOUSING PRIVATE LIMITED,Vijayawada,Strike Off,-
U45300WB1994PTC066556,ASTABHUJA PROPERTIES PRIVATE LIMITED,Kolkata,Active,astabhuja17@gmail.com
U45201WB2003PTC097039,MANJU ESTATES PRIVATE LIMITED,Kolkata,Active,manju@mlagroupindia.com
U40102TG2009PTC065272,GOLDSTONE POWER PRIVATE LIMITED,Hyderabad,Active,gold.power@yahoo.com
U26933RJ1996PTC012130,AMBICA CERAMICS PVT LTD,Jaipur,Active,guptakunj@hotmail.com
U85110KA1992PTC013623,TRENDSWEAR EXPORTS (INDIA) PRIVATE LIMIT ED,Bangalore,Strike Off,kkrao6@rediffmail.com
U15100TZ2017PTC029711,PRESAM FOOD PRODUCTS INDIA PRIVATE LIMITED,Coimbatore,Strike Off,presamfoodproducts@gmail.com
U70109TN2009PTC072450,JSE PROPERTY DEVELOPERS PRIVATE LIMITED,Chennai,Strike Off,jaigan75@yahoo.com
U22200MH1971NPL015200,BOMBAY MASTER PRINTERS ASSOCIATION,Mumbai,Active,office@bmpa.org
AAE-1482,ARBA TRENDS LLP,Delhi,Active,amitkumar@polyplex.com
U15400UP2016PTC087522,7 LOTUS ELEVENSES PRIVATE LIMITED,Kanpur,Active,CASATISHGUPTA1962@GMAIL.COM
U74900WB2012PTC189348,P A IMPORTS PRIVATE LIMITED,Kolkata,Active,paimportsindia@gmail.com
U17119RJ2009PTC028464,JALAN TEXFAB PRIVATE LIMITED,Jaipur,Active,jelbrow@rediffmail.com
U24234TZ1998PTC008420,SORUPKAR SIDDHA PHARMA PRIVATE LIMITED,Coimbatore,Strike Off,-
U51101MH2014PTC257208,AKA GLOBAL EXIM PRIVATE LIMITED,Mumbai,Strike Off,corporate_ngppm@yahoo.co.in
U45400MH2003PTC141499,BRADY ESTATES PRIVATE LIMITED,Mumbai,Active,cs@bradys.in
U99999MH1986PTC039517,MAGNUM CONSULTANCY SERVICES PVT LTD,Mumbai,Strike Off,-
U45201RJ1992PTC006421,BUILDERS ALLIANCE PRIVATE LIMITED,Jaipur,Active,infojaipur@ghpcorp.com
U70101WB1996PTC077526,SHARVI FINCON PVT LTD,Kolkata,Active,sharvifincon@yahoo.com
AAX-4988,CONRAD AGRICO LLP,Ahmedabad,Active,realtechforge@yahoo.in
U45201GJ1991PTC015094,BANKERS ESTATE PVT.LTD.,Ahmedabad,Strike Off,-
U74900TN2014OPC096019,COLEROON SHORE DESIGN SERVICES PRIVATE LIMITED (OPC),Chennai,Strike Off,-
U74999DL2016PTC299086,FORTUNA BUSINESS PRIVATE LIMITED,Delhi,Strike Off,RISHABH@SCLPL.CO.IN
U15200DL1991PTC045316,MOHAN DAIRY PRODUCTS PRIVATE LIMITED,Delhi,Strike Off,-
U27310PB1993PTC013639,SUTLEJ COACH PRODUCTS PRIVATE LIMITED,Chandigarh,Active,accounts@sutlejproducts.com
U93000WB2011PTC170405,ALANKIT E-FILING CONSULTANT PRIVATE LIMITED,Kolkata,Strike Off,khemka2007@gmail.com
AAJ-3023,SAHYADRI LIFESPACES LLP,Pune,Active,ketanbhondve4444@gmail.com
U29100KA2019FTC124632,GL-TURBO INDIA PRIVATE LIMITED,Bangalore,Active,chandru.thiru@glturbo.com
U65992KA2013PTC069631,LAXMESHWAR SUNRISE CHITS INDIA PRIVATE LIMITED,Bangalore,Strike Off,naveen.bellatti88888@gmail.com
U72900MH2018PTC308642,EZDATA MUNCH PRIVATE LIMITED,Mumbai,Active,dilipubhayakar@hotmail.com
U01113BR2020PTC048406,INDORGANIC NATURAL GREEN PRODUCER COMPANY LIMITED,Patna,Active,indorganicranjay@gmail.com
U17299TG2016PTC109660,SAHASRA PACK PLUS PRIVATE LIMITED,Hyderabad,Active,sjreddy.ca@gmail.com
U72900PN2017PTC171510,MOHAR TECHNOLOGIES PRIVATE LIMITED,Pune,Active,shashank.chandavale@mohar.co.in
U74999TG2021PTC147653,MANAM SEEDS PRIVATE LIMITED,Hyderabad,Active,ajaygudeti@gmail.com
U74899DL1994PTC061712,DICKY SECURITIES PRIVATE LIMITED,Delhi,Strike Off,topcorp@rediffmail.com
AAA-1704,KHIMJI KUNVERJI PROPERTIES INDIA LLP,Mumbai,Active,ketan@kkc.in
U74999PN2019PTC184373,SRN SOFTECH SERVICES PRIVATE LIMITED,Pune,Active,nitinhiremath89@gmail.com
U51909TN2002PTC048909,R.P.NARTHAN EXPORTS PRIVATE LIMITED,Chennai,Strike Off,-
U31900DL2019PTC359451,YUHANI INDUSTRIES PRIVATE LIMITED,Delhi,Under Process of Striking Off,yuhaniindustries@gmail.com
U15122AP2015PTC095950,SRIKA AGRO FARMS & EXPORTS PRIVATE LIMITED,Vijayawada,Strike Off,ca.mvsreddy.roc@gmail.com
U72900GJ2021FTC124767,AXCELLENT SOLUTIONS (INDIA) PRIVATE LIMITED,Ahmedabad,Active,chulamehta1966@gmail.com
U45201TZ2019PTC031618,SRI SWARNNAS INDIA PRIVATE LIMITED,Coimbatore,Active,anandha34@gmail.com
U92111MH2001PTC130415,FLICKS INDIA PRIVATE LIMITED,Mumbai,Strike Off,-
U74120MH2011PTC214756,SHIVSAGAR HOSPITALITY PRIVATE LIMITED,Mumbai,Strike Off,satishhemmady@yahoo.com
U93090MH2017PTC296744,LITTO FACILITY MANAGEMENT INDIA PRIVATE LIMITED,Mumbai,Strike Off,manjananu@yahoo.com
U51500DL2006PTC152757,KITSON ENTERPRISES PRIVATE LIMITED,Delhi,Amalgamated,kitsonenterprises1@rediffmail.com
U55100PN2004PTC152696,SAVANNAH HOTELS PRIVATE LIMITED,Pune,Amalgamated,umeshparekh@desaibrothers.com
U27100CT2008PTC020980,INDUS VALLEY ISPAT PRIVATE LIMITED,Chhattisgarh,Active,itcacdept@gmail.com
U28133GJ2002PTC040718,BALKRISHNA BOILERS PRIVATE LIMITED,Ahmedabad,Active,balkrishna_account@yahoo.com
AAJ-8265,SAHEYAT FOOD ENTERPRISES LLP,Bangalore,Active,reghuram.naik1@gmail.com
U74210DL1993PTC052658,PREMIER DEVELOPERS PRIVATE LIMITED,Delhi,Strike Off,-
AAF-4089,ROOT MACHINERY LLP,Pune,Active,VIKAS.DUDHE@VTECH.ORG.IN
U74999UP2018PTC104404,DEEPSHA CONSULTANTS PRIVATE LIMITED,Kanpur,Active,deepshaconsulting@gmail.com
U51909GJ2020PTC115285,RUGNATH TRIKAMDAS IMPEX PRIVATE LIMITED,Ahmedabad,Active,modi.cgnpb2540r@gmail.com
U74110MH1993PTC072537,COPITA TRADING PRIVATE LIMITED,Mumbai,Active,ljtannagroup@gmail.com
U74110MH2013PTC247871,FINTONIC MANAGEMENT CONSULTANTS PRIVATE LIMITED,Mumbai,Active,fintonicpms@gmail.com
U30009GJ1989PTC011887,SILICON AUTOMATION SYSTEMS PVT.LTD.,Ahmedabad,Strike Off,-
AAN-8892,AJAR MALL MULTIPLEX LLP,Mumbai,Active,rajivrmalhotra711@gmail.com
U51909WB2007PTC117591,KANAV MARKETING PRIVATE LIMITED,Kolkata,Converted to LLP,kanodia2101@gmail.com
U93090GJ2017PTC098313,SIDDHHEM WATERPARK & RESORT PRIVATE LIMITED,Ahmedabad,Strike Off,prajapatihardik23@gmail.com
U72900MP2019PTC048693,AGNIGATE TECHNOLOGIES PRIVATE LIMITED,Gwalior,Active,chetanitegn@gmail.com
U72200TG2021PTC156701,AKSA IT SYSTEMS PRIVATE LIMITED,Hyderabad,Active,Kvytla@gmail.com
U55101RJ1991PTC005790,NIHAL HOTELS PVT.LTD.,Jaipur,Strike Off,-
U25209DL2003PTC122305,R LAMIFILM KOREA PRIVATE LIMITED,Delhi,Active,rlamifilm@gmail.com
U45400MH2011PTC214258,SHANTI NIKETAN CONSTRUCTION PRIVATE LIMITED,Mumbai,Active,hirenvdoshi80@yahoo.co.in
U70102HR2014PTC052402,MUKUND REALTECH PRIVATE LIMITED,Delhi,Strike Off,gullii0009@gmail.com
U85110JK2021PTC012153,MEDVALLEY HEALTHCARE PRIVATE LIMITED,Jammu,Active,nkohrinassociates@gmail.com
U74120TG2011PTC076987,AXISMETRO CONSULTING ENGINEERS PRIVATE LIMITED,Hyderabad,Strike Off,jaweed@metroconsultants.in
U70100MH2000PTC127459,DOLPHIN REALTY PRIVATE LIMITED,Mumbai,Strike Off,-
U74900DL2015PTC284845,FATMAN TECHNOLOGY PRIVATE LIMITED,Delhi,Active,hpindigo.jai@gmail.com
AAE-4297,SITARA UNICHEMICALS LLP,Ahmedabad,Active,PAURAK@GMAIL.COM
U74999RJ2017OPC059320,TUEWED PRO70 (OPC) PRIVATE LIMITED,Jaipur,Active,caankitgupta27@gmail.com
U51900HR2016OPC065839,PARNAL INDUSTRIES INDIA (OPC) PRIVATE LIMITED,Delhi,Active,yogeshdod55@gmail.com
U45209PB2012PTC036211,GODARA INFRATAINMENT PRIVATE LIMITED,Chandigarh,Strike Off,cssourabhparnami@gmail.com
U73200KA2018PTC124149,SPEROGENX BIOSCIENCES PRIVATE LIMITED,Bangalore,Active,info@sperogenx.com
U74999TG2016PTC112675,DRAVIDAS BUSINESS SOLUTIONS PRIVATE LIMITED,Hyderabad,Strike Off,SHARATCREDDY@GMAIL.COM
U74994KA2018PTC117014,URBANSPACES MARKETING PRIVATE LIMITED,Bangalore,Active,sarathkb@yahoo.com
U45203UP1991PTC012942,JANKI PRASAD GARDEN ENCLAVE PRIVATE LIMITED,Kanpur,Strike Off,rangoliag@yahoo.com
U61200MH2010FTC206739,MARITIME MONTERING NORINCO INDIA PRIVATE LIMITED,Mumbai,Active,cs@marinor.co.in
U24292MP2019PTC050519,SHIVHARE METALS PRIVATE LIMITED,Gwalior,Active,shivharesales03@gmail.com
U01111MH1996PTC097332,KOKAN BHOO VA KRUSHI VIKAS PRIVATE LIMITED,Mumbai,Active,-
U15200BR2022PTC056166,RATNESHWARI FOODS AND BEVERAGE PRIVATE LIMITED,Patna,Active,cics4835@gmail.com
U72900DL2003PTC123461,IMMEDIANCE INDIA PRIVATE LIMITED,Delhi,Strike Off,-
U70109HR2014PTC052014,SHREE DHYAN INFRACON PRIVATE LIMITED,Delhi,Active,sdal.2005@gmail.com
U74220UP2019PTC117402,CALYSS CALIBRATION & TESTING PRIVATE LIMITED,Kanpur,Active,calysscal@gmail.com
U80903MH2021PTC364317,MHTEEB PRIVATE LIMITED,Mumbai,Active,gotarnedurgesh007@gmail.com
AAA-8967,RITVIK DEVELOPERS LLP,Pune,Active,accounts@shahgrouppune.com
U70101DL2009PTC193832,NSC INFRASTRUCTURE PRIVATE LIMITED,Delhi,Active,nscinfrastructure1@outlook.com
U51109WB1988PLC044751,INDOTAN CHEMICALS LTD,Kolkata,Active,payal@jcgroup.in
U51909GJ2020PTC117015,ARYAMA COMTRADE PRIVATE LIMITED,Ahmedabad,Active,dakshgroup001@gmail.com
U15490PN2015OPC157162,ARCANO FOODS (OPC) PRIVATE LIMITED,Pune,Active,yashovardinifoods@gmail.com
AAU-9676,PHONEIX RING FORGE INDUSTRY LLP,Pune,Active,ca.pratikpshah@gmail.com
U45400PN2015PTC155656,SINDHURATNA CONSTRUCTIONS AND LABOUR SUPPLIERS PRIVATE LIMITED,Pune,Strike Off,surbhiconstructions@gmail.com
U74999TN2016PTC111079,LACUS RESOURCES PRIVATE LIMITED,Chennai,Strike Off,lacusresources@gmail.com
U63090PN2013PTC146819,SANJEET TRAVELS PRIVATE LIMITED,Pune,Strike Off,sanjeettravels@yahoo.in
AAB-2213,SMART CERTIFICATION LLP,Delhi,Defunct,info@scllp.com
AAS-8805,JLMB ENTERPRISES LLP,Delhi,Active,kavitaconsultancyservices@gmail.com
U67120MH1994PTC082270,PERPETUAL GROWTH INVESTMENTS PRIVATE LIMITED,Mumbai,Active,pgipl1907@gmail.com
U45203MH2008PTC185703,STINGER DRAFTING PRIVATE LIMITED,Mumbai,Active,yuvraj@stingerdrafting.co.in
U74140GJ1994PTC021858,HONDAI ACCOUNTANCY PVT LTD,Ahmedabad,Strike Off,-
U70109WB2011PTC168685,STABLE INFRAPROPERTIES PRIVATE LIMITED,Kolkata,Converted to LLP,contactmycompanies@gmail.com
U45400WB2010PTC150358,INTERCITY BUILDERS PRIVATE LIMITED,Kolkata,Active,returnco2015@yahoo.co.in
U51392TN2004PTC054913,APSARAS TRADE IMPEX PRIVATE LIMITED,Chennai,Strike Off,-
U93020DL2018PTC331116,SANTAMENTAL INTERACTIVE PRIVATE LIMITED,Delhi,Active,accounts@sampanmedia.com
U51909WB2013PLC192105,TOUCHWOOD VINCOM LIMITED,Kolkata,Converted to LLP,touchwoodvincom@gmail.com
AAE-1433,PANMED HEALTH CARE LLP,Ernakulam,Active,panmedhealthcare@gmail.com
U00222KA1988PTC009506,SRI RAM DISTILLERIES PRIVATE LIMITED,Bangalore,Strike Off,-
U45309MH2018PTC315872,PHANTOM LANDMARKS PRIVATE LIMITED,Mumbai,Active,rafeeqmanji@gmail.com
U01820DL2017PTC326711,GARHGANGA JAIVIK ANN PRIVATE LIMITED,Delhi,Strike Off,compliances@aristotleconsultancy.com
U40100MH2000PTC124656,WIND WORLD WIND FARMS (UP) PRIVATE LIMITED,Mumbai,Active,ipp.compliance@windworldindia.com
U00892JH1998PTC008449,BANSHI COMPUTERS & CONSULTANT PRIVATE LI MITED,Jharkhand,Strike Off,-
U74999DL2001PTC113537,ECONOMIC PARADISE DISCOUNT CARDS PRIVATE LIMITED,Delhi,Strike Off,-
U14220DL2008PTC172458,AMAZON MINERALS PRIVATE LIMITED,Delhi,Strike Off,legalroc@gmail.com
U24239RJ2020PTC070448,GREEN PARTICLE BIOTECH PRIVATE LIMITED,Jaipur,Active,manish.hnlu@gmail.com
U75100GJ2007PLC051160,GUJARAT INTERNATIONAL FINANCE TEC-CITY COMPANY LIMITED,Ahmedabad,Active,udit.mehta@giftgujarat.in
U51100MH2020PTC344147,KIMAT TRADING PRIVATE LIMITED,Mumbai,Active,kimattradingpvt@yahoo.com
AAV-1978,PARK SOLITAIRE LIFE SPACES LLP,Mumbai,Active,parklifespaces@gmail.com
U72200DL2021PTC389125,EQUIVALENT IO TECHNOLOGIES PRIVATE LIMITED,Delhi,Active,VAIBHAV@DEFINELABS.COM
U15100MH2022PTC374942,SHRIKHANDWALA FOOD PRODUCTS PRIVATE LIMITED,Mumbai,Active,ninadmohidekar@gmail.com
U74999MH1953PTC009149,D.B.FUTNANI AND SONS PRIVATE LIMITED,Mumbai,Active,-
U92413DL2014PTC274512,IHW MEDIA PRIVATE LIMITED,Delhi,Active,kamal@teamworkpublicrelations.com
U24290MH2016PTC283648,AEGEUS LIFESCIENCES PRIVATE LIMITED,Mumbai,Active,aegeuslifesciences@gmail.com
U51109WB1991PTC051751,ASTRO EXIM & FINVEST PVT.LTD.,Kolkata,Strike Off,-
U85310WB2021NPL242540,KOLKATA ONCOLOGY RESEARCH FOUNDATION,Kolkata,Active,kolkataoncologyresearchgroup@gmail.com
U51909GJ2018PTC101766,TRIZONE ELECTRICALS SERVICES PRIVATE LIMITED,Ahmedabad,Active,trizoneelectricals@gmail.com
U60230WB2007PTC161682,RAILPAL LOGISTICS PRIVATE LIMITED,Kolkata,Active,RAKESH202@HOTMAIL.COM
U74999AP2018OPC109209,DWARAKADHRI MINERALS (OPC) PRIVATE LIMITED,Vijayawada,Active,kkvalluri81@gmail.com
U51909MH2010PTC203055,TRIMEX POLYMERS PRIVATE LIMITED,Mumbai,Strike Off,deen@intelliob.com
U75110DL2013PTC256144,MARVELTEAM SECURITY SERVICES PRIVATE LIMITED,Delhi,Strike Off,vkrastogi@yahoo.com
U72900MP2018PTC045016,CINFYTECH WEB SYSTEMS PRIVATE LIMITED,Gwalior,Active,ctiwari.pmp@gmail.com
U45309MH2021PTC370391,SHREE S S INFRA DEVELOPERS PRIVATE LIMITED,Mumbai,Active,sssbd12@gmail.com
U65992AP1987PTC007476,PAVITRA CHIT FUNDS PVT LTD,Vijayawada,Active,pavitrachitfund@gmail.com
U74300TG1988PTC009196,MESSAGE ADS PVT LTD.,Hyderabad,Active,-
U72100UP2015PTC071885,SOPHONT TECHNOLOGIES PRIVATE LIMITED,Kanpur,Active,anilchdry@gmail.com
U51909MH2019PTC327032,SAMSPEEDY DISTRIBUTION PRIVATE LIMITED,Mumbai,Active,speedysameer@yahoo.co.in
U73100TG2018PTC126772,RANKS RESEARCH PRIVATE LIMITED,Hyderabad,Active,fasi_khaja@rediffmail.com
U74120DL2007PTC167021,TENAGA PARKING SERVICES (INDIA) PRIVATE LIMITED,Delhi,Active,manindersinghsawhney@gmail.com
U74999MH2016PTC281370,BLUE OCEAN IMC PRIVATE LIMITED,Mumbai,Active,rahat@blueoceanimc.com
U45200AP1997PTC027068,VCS RAJU CONSTRUCTIONS PRIVATE LIMITED,Vijayawada,Active,-
U63000DL2014PTC272261,KNR GLOBAL LOGISTICS PRIVATE LIMITED,Delhi,Strike Off,cahimanshubansal1012@gmail.com
U74900DL1995PTC066800,AARNA IMPEX PRIVATE LIMITED,Delhi,Active,aarnaimpex@gmail.com
U72200GJ2003PTC043391,SQUAD TECHNOLOGIES PRIVATE LIMITED,Ahmedabad,Active,agrashutosh@gmail.com
U01122PN1997PTC106956,FLARE AGRO CONSULTECH PRIVATE LIMITED,Pune,Strike Off,-
U61100MH1996PTC101311,ARAMEX INDIA PRIVATE LIMITED,Mumbai,Active,secretarial_india@aramex.com
AAQ-2643,BROADIFI TECHNOLOGIES LLP,Kolkata,Active,sumanm27@gmail.com
U80221CT2010PTC022105,MIMS SCHOOL EDUCATION PRIVATE LIMITED,Chhattisgarh,Strike Off,companysecretary@everonn.com
U67190DL1986PLC023438,ONIDA CREDIT AND INVESTMENT LIMITED,Delhi,Strike Off,namita.bhatnagar@onicra.com
AAS-5404,SOVIN INNOVATIVE SOLUTIONS LLP,Mumbai,Active,sovin@pineapple.net.in
U51109WB1994PTC066287,WOODHAT DISTRIBUTORS PVT LTD,Kolkata,Active,woodhatdistributors1994@gmail.com
U70200UP2017PTC091742,BASIC INFRA DEVELOPER PRIVATE LIMITED,Kanpur,Active,aoipp0122l@rediffmail.com
AAR-5808,IRESH INFRAHEIGHTS LLP,Kanpur,Active,gagan10tiwari@gmail.com
U65910GJ1997PTC031784,SHUBHAM SHRESTHA TRADEFIN PRIVATE LIMITED,Ahmedabad,Active,sanjaysurana1976@yahoo.com
U28920TN2006PTC060662,SURFACE TREATMENT SYSTEMS (CHENNAI) PRIVATE LIMITED,Chennai,Strike Off,stspowdercoating@gmail.com
U74900DL2012PTC229946,ARTBEAT STORE PRIVATE LIMITED,Delhi,Strike Off,babbankaur@gmail.com
AAN-5020,JUPITER COMMUNICATION LLP,Mumbai,Active,kocharchaitanya@rediffmail.com
U70109HP2010PTC031275,PLG INFRASTRUCTURE PRIVATE LIMITED,HimachalPradesh,Strike Off,KUMARRAVI_CA@YAHOO.COM
U74999MH2022PTC376847,HTV MARKETPLACE PRIVATE LIMITED,Mumbai,Active,nehal24@gmail.com
U51909PN2016PTC164732,REMEDIUM PHARMA PRIVATE LIMITED,Pune,Active,CAMAHESHTOSHNIWAL@GMAIL.COM
U35999CT2021PTC012284,DAYBEST JOURNEY AERO SYSTEM PRIVATE LIMITED,Chhattisgarh,Active,infodeveshjha@gmail.com
U65992DL1992PTC048631,RAGHURAJ CHITS PRIVATE LIMITED,Delhi,Strike Off,-
U70100UP2014PTC063846,VARIANT BUILDERS PRIVATE LIMITED,Kanpur,Active,obaidmkhan82@yahoo.com
U11100DL2015PTC280806,SURVIVAL MATRIX PRIVATE LIMITED,Delhi,Active,survival.matrix2015@gmail.com
U45201GJ2011PTC063499,NIHAR DEVELOPERS PRIVATE LIMITED,Ahmedabad,Active,hirenvdoshi80@yahoo.co.in
U80222WB2019NPL234363,KISHOLOY OF BENGAL FOUNDATION,Kolkata,Active,anjan.majumder1953@gmail.com
U18109DL2013PTC252717,DHUNNA FASHION HOUSE PRIVATE LIMITED,Delhi,Strike Off,returnsgb@gmail.com
U32109UP1993PTC015785,NOIDA-ZAC EX-IM PRIVATE LIMITED,Kanpur,Strike Off,-
U60222HR2018PTC075151,TUSKERS LOGISTICS & WAREHOUSING PRIVATE LIMITED,Delhi,Strike Off,accounts@tuskersindia.com
U50102GA2003PTC003337,SHIVSAMARTH MOTORIDERS PRIVATE LIMITED,Goa,Active,hr@shivsamarth.com
U72200KL2017PTC048406,WAY DOT COM INDIA PRIVATE LIMITED,Ernakulam,Active,briji.skumar@way.com
U55209JH2021PTC016047,GROW ON ENTERPRISES PRIVATE LIMITED,Jharkhand,Active,ranchi.skj@gmail.com
U52609PN2017PTC171055,ADVISION TECHNOLOGIES PRIVATE LIMITED,Pune,Strike Off,FINVIEWS@OUTLOOK.COM
U30009GJ1996PTC029818,MICROLINK SOLUTIONS PRIVATE LIMITED,Ahmedabad,Active,accounts@microlink.co.in
U65993WB1987PTC043336,FINE HOLDINGS PVT LTD,Kolkata,Strike Off,-
U45400WB2009PTC139574,KOLKATA ABASAN PRIVATE LIMITED,Kolkata,Active,cs@srijanrealty.com
U70102WB2016PTC209382,ABITHA REALTY PRIVATE LIMITED,Kolkata,Active,rajesh.sin14@gmail.com
U22219DL1956PTC002689,ZODIAL PUBLISHING CORPORATION PRIVATE LIMITED,Delhi,Strike Off,-
U55209WB2020PTC235886,AMRITAS FOODS AND BEVERAGES PRIVATE LIMITED,Kolkata,Active,amritabpl@gmasfil.com
U74110KA2012PTC063067,OLE AUTOMATION INDIA PRIVATE LIMITED,Bangalore,Active,sk@oleautomation.com
U65992KL2010PTC027208,WHITEFLOWER CHITS PRIVATE LIMITED,Ernakulam,Active,whiteflowerchits2@gmail.com
U50400UP2021PTC142462,KANPUR FITMENT CENTER PRIVATE LIMITED,Kanpur,Active,mailus.kfcpl@gmail.com
U74900PB2008PTC031913,GREATWAY OVERSEAS EDUCATION & IMMIGRATION PRIVATE LIMITED,Chandigarh,Strike Off,sahilrastogi_ca@hotmail.com
U92113KL2020PTC066510,NEWSVALUE PRODUCTIONS PRIVATE LIMITED,Ernakulam,Active,ASWATHYMTV@GMAIL.COM
U93090DL2020PTC371696,HOPMAX ALUME INDIA PRIVATE LIMITED,Delhi,Active,BHATTMAYANK924@GMAIL.COM
U74999HR2017PTC069091,DEVENDER MILK PRIVATE LIMITED,Delhi,Strike Off,info@csnitesh.com
U45201GJ1997PTC033284,FUTURE BUILDCON PRIVATE LIMITED,Ahmedabad,Strike Off,-
U51223TN2004PTC054286,ANU MARINE EXPORTS PRIVATE LIMITED,Chennai,Strike Off,pnr49@rediffmail.com
U93000UR2012PTC000405,AADINATH INFRA DEVELOPERS PRIVATE LIMITED,Uttarakhand,Active,aadinathinfra.dpl999@gmail.com
U74990UR2020PTC010906,TAHA BUSINESS SOLUTIONS PRIVATE LIMITED,Uttarakhand,Active,manishsethi_15@yahoo.co.in
U52340UP1947PTC001627,SILVER GLASS WORKS PRIVATE LIMITED,Kanpur,Liquidated,-
U74999KA2019PTC125990,GURUKARANA SAVING SOLUTIONS PRIVATE LIMITED,Bangalore,Active,gurukarana@yahoo.com
U63030DL2020PTC373290,TRAVSURGE PRIVATE LIMITED,Delhi,Active,fshawaiz@gmail.com
AAL-8697,SPJ TRAVELS.COM LLP,Mumbai,Active,jadhasha@gmail.com
U74140DL2013PTC258846,AUMYAA ADVISORY SERVICES PRIVATE LIMITED,Delhi,Active,manish.kumar@sw-india.com
U85110WB2008PLC127561,RONIT HOSPITAL LIMITED,Kolkata,Strike Off,mailofclients@yahoo.co.in
U72200MP2018PTC045530,TECONICA SOFTWARES PRIVATE LIMITED,Gwalior,Active,piyushh2004@gmail.com
U74899DL1983PTC017056,MOUNT SHIVALIK PACKAGING PRIVATE LIMITED,Delhi,Active,shares@mountshivalik.in
U74999MH2019PTC330061,PERKETY SOLUTIONS PRIVATE LIMITED,Mumbai,Active,dhirajjain19@gmail.com
U74999HR2017PTC069860,JIVINE FITNESS PRIVATE LIMITED,Delhi,Active,ashitmaru@gmail.com
U74900DL2011PTC226521,BALAJI UTILITY & SUPPLY PRIVATE LIMITED,Delhi,Strike Off,SANDH_RAJ@YAHOO.COM
U40200PN2022PTC208173,BIOMASS INDIA FUEL SUPPLY CHAIN MANAGEMENT PRIVATE LIMITED,Pune,Active,surekhakadu.sk@gmail.com
U70109RJ2016OPC056466,ARS INFRAHOME (OPC) PRIVATE LIMITED,Jaipur,Active,rohitemerald23@gmail.com
U60230DL2019PTC350883,AS OBEROI LOGISTIC PRIVATE LIMITED,Delhi,Active,prince.oberoi714@gmail.com
U65921TZ1991PTC003383,MANGALA GANESH FINANCIAL SERVICES PRIVAT E LIMITED,Coimbatore,Strike Off,msureshraja@gmail.com
U24294MH1981PTC025372,PRINT ENGI CHEM PVT LTD,Mumbai,Active,engichem@hotmail.com
U72900KA2011PTC061652,DIGITAL NETWORTH PRIVATE LIMITED,Bangalore,Strike Off,BALA@LIGHTHOUSEINDIA.IN
U74140DL2006PTC181629,CARVAL INDIA PRIVATE LIMITED,Delhi,Dissolved,india_cargillgroup@cargill.com
U45201MP1998PTC013099,SARVODAYA AVAS NIRMAN PRIVATE LIMITED,Gwalior,Strike Off,-
U29253GJ2013PTC073619,JAMES ENGITECH PRIVATE LIMITED,Ahmedabad,Strike Off,avm_it@hotmail.com
U65991TN1994PLC027909,SOWCARPET GANAPATHI LAKSHMI BENEFIT FUND LIMITED,Chennai,Strike Off,-
U18101DL2008PTC175980,JASMINE GARMENTS PRIVATE LIMITED,Delhi,Converted to LLP,projects@devproduct.com
U52520DL2020PTC364506,BUCKLER SECURITY SERVICES PRIVATE LIMITED,Delhi,Active,shub1611@yahoo.in
U51109MH2010PTC208375,SUMO MERCANTILE PRIVATE LIMITED,Mumbai,Active,spsharma1943@gmail.com
U55209WB2021PTC247145,H FRANKYS CAFE PRIVATE LIMITED,Kolkata,Active,caamangarg121@gmail.com
AAA-4778,MAHIMA TIRTH YATRA COMPANY LLP,Jaipur,Active,YOGES753@HOTMAIL.COM
U70109CH2021PTC043842,INFINIUM HOMES PRIVATE LIMITED,Chandigarh,Active,Gauravbajajrealtors@gmail.com
U15142TN1986PTC013495,UNIVAC PRODUCTS PVT. LTD.,Chennai,Strike Off,-
ABA-4778,SINGLO SUFFRY TEA ESTATE LLP,Shillong,Active,mail2rajanlohia@gmail.com
U67190DL2012PLC244719,S P JINDAL FINANCIAL SERVICES LIMITED,Delhi,Active,info.spjindalfinancialsrvcltd@gmail.com
U74120DL2015PTC305275,KAICELL ELECTRONICS PRIVATE LIMITED,Delhi,Active,kaicellelectronics@gmail.com
U85110TZ2009PTC015580,N M S HOSPITAL PRIVATE LIMITED,Coimbatore,Active,manibalu222739@yahoo.co.in
U72200TN2005PTC055214,NEWSHADES TECHNOLOGIES PRIVATE LIMITED,Chennai,Strike Off,ahmed@newshades.com
U72200KL1996PTC009849,JESS SYSTEMS PRIVATE LIMITED,Ernakulam,Strike Off,-
U51902MP1996PTC010892,SHEKHAR CHEMICALS PRIVATE LIMITED,Gwalior,Strike Off,-
U74999DL2020PTC365063,ANNAPOORTI ESSENTIALS PRIVATE LIMITED,Delhi,Active,annapoortiessentials@gmail.com
U99999DL1999PTC099891,HARSIMRAN ALUMINIUM PRIVATE LIMITED,Delhi,Strike Off,-
U70100UP2004PTC028569,KAPILESH TRADELINK PRIVATE LIMITED,Kanpur,Active,kapilesh2019@gmail.com
U64200HR2021PTC098310,CHATRIWALE DIGITAL SERVICE PRIVATE LIMITED,Delhi,Active,gagansalesandservices@gmail.com
AAP-3322,AL ANSAR SPECIALITY CLINIC LLP,Ernakulam,Strike Off,basheeroralakoth@gmail.com
U17297PN1993PTC072807,DOIJAD TEXTILES PVT.LTD.,Mumbai,Strike Off,-
U52390WB2019PTC233468,TELEDRISTI TREXIM PRIVATE LIMITED,Kolkata,Active,alokenaskaraqm@gmail.com
U24232BR2013PTC020625,SILEXX HEALTHCARE PRIVATE LIMITED,Patna,Strike Off,info@eformation.co.in
AAQ-4071,QUANTIC REACH LLP,Mumbai,Active,quantic.reach@gmail.com
