U33309OR2022PTC038679,RN BIOMEDICAL PRIVATE LIMITED,Cuttack,Active,drniveditasahoo81@gmail.com
U45400WB2009PTC138903,TODI REALTY PRIVATE LIMITED,Kolkata,Strike Off,ESSEL8@VSNL.NET
U45202GJ1999PTC035511,ASHISH COMPLEX OWENERS'ASSOCIATION PRIVA TE LIMITED,Ahmedabad,Strike Off,-
U51900UP2020PTC134558,AADVIK TRADERS PRIVATE LIMITED,Kanpur,Active,RAVIRAZAQ@GMAIL.COM
U45200TG1997PTC026920,NOVA PROJECTS PRIVATE LIMITED,Hyderabad,Strike Off,-
U72200TG2016PTC102730,SAN TECHNOLOGIES PRIVATE LIMITED,Hyderabad,Active,raj@saninfotech.co.uk
U45400WB2021PTC250184,ZENIX CONSTRUCTION AND SERVICES PRIVATE LIMITED,Kolkata,Active,jsasso2017@gmail.com
AAG-5494,HANDVOUGE LIFESTYLES LLP,Shillong,Strike Off,VIVIDINDIA.NEOG@GMAIL.COM
AAB-7314,VIVID O D BANQUETS & EVENTS LLP,Pune,Active,glenn.joseph17@gmail.com
U74999JH2018PTC011410,HIEOCIOK DPR BUSINESS CONSULTANCY PRIVATE LIMITED,Jharkhand,Active,raanopandey03@gmail.com
U27310TG2013PTC085794,ONLINESTEEL INDIA PRIVATE LIMITED,Hyderabad,Strike Off,aakashstemcor@gmail.com
U70109DL2021PTC391651,MAHAKALI ELEVATION ESTATES PRIVATE LIMITED,Delhi,Active,neha@mahakali-developers.com
U17120MH1985PTC036736,ARIHANT FIBRES PVT LTD,Mumbai,Active,-
U70200TN2020PTC136410,AVIGNA IRRA PRIVATE LIMITED,Chennai,Active,sivakumarg@avigna.in
U40100MP2018PTC047194,ARCHITA RENEWABLE ENERGY PRIVATE LIMITED,Gwalior,Active,saurabhbajpai_in@yahoo.com
AAP-1330,PURE EVA LLP,Delhi,Active,hanumanagro@gmail.com
U31506DL2012PTC229573,PMEX ENERGY CORPORATION PRIVATE LIMITED,Delhi,Strike Off,europoles@gmail.com
U99999UP1988PTC010131,MAHESHWARI CHIT FUND PVT LTD,Kanpur,Strike Off,-
U15495OR1995PTC003940,AGARWAL SPICES AND FOOD PROCESSORS PRIVATE LIMITED,Cuttack,Active,ctk.sandeep@gmail.com
AAT-2851,ALOKAH FOOD FACTORY LLP,Vijayawada,Active,Alokahfoodfactory9@gmail.com
U63000DL2011PTC223024,CHARLIE FREIGHT SYSTEMS PRIVATE LIMITED,Delhi,Active,ceo@charliefreightsystems.com
U80904UP2019PTC121396,APPISTEME PRIVATE LIMITED,Kanpur,Active,paniakash@gmail.com
U65993GJ1981PTC004817,REDOLANT INVESTMENT PRIVATE LIMITED,Ahmedabad,Strike Off,-
U99999MH1961PLC012027,ASIAN TYRE SERVICE PRIVATE LIMITED,Mumbai,Dissolved,-
U51909KL2005PTC018422,TRINITY TELECOM SOLUTIONS (INDIA) PRIVATE LIMITED,Ernakulam,Active,trinity.tvm@rediffmail.com
U01405GJ2006PTC048941,RAMKRUPA GINNING AND PRESSING PRIVATE LIMITED,Ahmedabad,Active,ramkrupagin@yahoo.in
U51398WB1993PTC059437,MADHULIKA TRADING COMPANY PVT LTD,Kolkata,Converted to LLP,kpcaco@rediffmail.com
U74999DL2021PTC386713,COLORVISTA INNOVATIONS PRIVATE LIMITED,Delhi,Active,colorvista@hotmail.com
U74900TG2015PTC100324,CMP ELECTRONICS INDIA PRIVATE LIMITED,Hyderabad,Strike Off,ragi1320@gmail.com
U01100UP2021PTC154411,AGROTECH ORGANIC FARMERS PRODUCER COMPANY LIMITED,Kanpur,Active,consultancy.fpo@gmail.com
U45200MH1994PTC076196,VIRTUE INFRASTRUCTURES PRIVATE LIMITED,Mumbai,Active,virtueinfrastructurespvtltd@gmail.com
U74210MH2005PLC153010,FAIRWINDS ASSET MANAGERS LIMITED,Mumbai,Active,ramesh.venkat@fairwinds.in
U99999DL1971PTC005876,CHANDRA AUTO SPARES AND ALLIED INDUSTRIE S PRIVATE LIMITED,Delhi,Strike Off,-
U70109DL2013PTC261266,HARATH INDIA PRIVATE LIMITED,Delhi,Active,harishmagon@gmail.com
U28920MH1980PTC022616,MECHELONIC ENGINEERS PRIVATE LIMITED,Mumbai,Active,info@mechelonic.in
AAH-8151,MALHAR TOOLING LLP,Pune,Active,kshitijrautrao@gmail.com
AAT-3097,SARG DESIGN STUDIO LLP,Pune,Active,yogesh@sarg.co.in
U65929UP2020PTC129447,REPAY DIGICOM PRIVATE LIMITED,Kanpur,Active,ajssup.info@gmail.com
U51900HR1999PTC064541,BREEZE TRADING PRIVATE LIMITED,Delhi,Amalgamated,fincos.secretarial@gmail.com
AAD-6513,VONART FASHION AND LIFESTYLE LLP,Bangalore,Active,info.nitakurian@gmail.com
U51101MH2011PTC220552,SHATBHISHA TRADING PRIVATE LIMITED,Mumbai,Strike Off,jainchandanbala@hotmail.com
U01403UP2015PTC075191,ADARSH JIWAN FARMER PRODUCER COMPANY LIMITED,Kanpur,Active,adarshjiwan@gmail.com
AAI-0487,MANI EARTH MINING AND EQUIPMENTS LIMITED,Jharkhand,Active,adityanjha75@gmail.com
U74999MH2015PTC263198,METRIX GLOBAL BUSINESS PRIVATE LIMITED,Mumbai,Strike Off,metrixglobalbusiness@gmail.com
U74999AP2017NPL104848,SAI TECHNOLOGY BUSINESS INCUBATOR FOUNDATION,Vijayawada,Active,anand_govi@yahoo.com
U63022WB2003PTC096538,SONAR BANGLA COLD STORAGE PRIVATE LIMITED,Kolkata,Active,sonai1234@yahoo.co.in
U51909MH2021PTC367930,PATTERNAGRO SERVICES PRIVATE LIMITED,Mumbai,Active,pattarnagroservices@gmail.com
U85110MP2008PTC020289,GIRJA NURSING HOME PRIVATE LIMITED,Gwalior,Strike Off,VJCGCO2@REDIFFMAIL.COM
U85300DL2022NPL393784,JAN AASRA FOUNDATION,Delhi,Active,singhbaljinder8865@gmail.com
U26943RJ1984PLC003056,PRAKASH CEMENT INDUSTRIES LTD,Jaipur,Strike Off,-
U73100UP2021PTC151782,PREDULIVE INNOVATIONS PRIVATE LIMITED,Kanpur,Active,shivanshudwivedi497@gmail.com
U45140MH1988PTC049935,TECHMAFIL CONSULTANCY SERVICES PRIVATE L IMITED,Mumbai,Strike Off,-
U17212HR2014PTC052051,W H I T E DREAMWORKS PRIVATE LIMITED,Delhi,Strike Off,singh.navdeep09@gmail.com
U70109UP2020PTC138516,PRAYAGAM INFRA PRIVATE LIMITED,Kanpur,Active,dhruvsingh0408@gmail.com
U18101DL2005PTC133566,MIRZA FABRIC PRIVATE LIMITED,Delhi,Active,mirzafabric@gmail.com
U93097BR2017NPL033497,SIDDHA LAKSHMI FOUNDATION,Patna,Active,dhanushdharijee@gmail.com
U01100MH2021PTC368315,WARDHA KARANJA MH FARMER PRODUCER COMPANY LIMITED,Mumbai,Active,Fpokaranja@gmail.com
U35204MH2001PTC132272,MUMBAI SOUTHERN ROADWAYS PRIVATE LIMITED,Mumbai,Active,southernroadways@mtnl.net.in
U74120DL2010PTC197860,KAT WIRELESS PRIVATE LIMITED,Delhi,Strike Off,ROC@RPLCA.COM
U24232WB1949PTC017487,HANUMANBAX SURAJMALL PVT LTD,Kolkata,Strike Off,-
U51900MH1991PTC063683,D.S.ENTERPRISES PVT.LTD.,Mumbai,Active,-
U65921KL1992PTC006430,GENERAL HIRE PURCHASE AND LEASING COMPAN Y PVT.LTD.,Ernakulam,Strike Off,-
U24299UP2022PTC157735,BORESH & NANDNI FERTILIZERS PRIVATE LIMITED,Kanpur,Active,aanuj.khare@gmail.com
AAK-1141,DURAMA AGRO TECHNOLOGIES LLP,Shillong,Active,abhijitactive@gmail.com
U65999MP2022PLN059811,MADHUKAR LAKSHMI NIDHI LIMITED,Gwalior,Active,IMPOSTHELP@GMAIL.COM
U74999UP2018PTC101795,MONERO GLOBAL COLLABORATIVE CONSULTANT PRIVATE LIMITED,Kanpur,Strike Off,SEDOCORPORATE@GMAIL.COM
U01409OR1984PLC001299,JAYABIJAY INDUSTRIES LIMITED.,Cuttack,Strike Off,-
AAZ-8222,REVATA HOSPITALITY LLP,Pune,Active,linda@revatahospitality.com
U63030AP2021PTC119594,AIM CARS INDIA PRIVATE LIMITED,Vijayawada,Active,waytowin.aim@gmail.com
U45200DL2010PTC201324,SANGHI DEVELOPERS & PROMOTERS PRIVATE LIMITED,Delhi,Strike Off,navjeet92ca@yahoo.com
U65992PY1964PTC000075,KARUNYAMURTHI CHIT FUND PVT LTD,Pondicherry,Strike Off,-
U70101DL2009PTC190427,NORTH RAJASTHAN PROMOTERS PRIVATE LIMITED,Delhi,Strike Off,northrasthanpromoters@rediffmail.com
U45200MH1994PTC082561,AKRUTI REALTORS PRIVATE LIMITED,Mumbai,Strike Off,-
U70102KA2009PTC051287,DNS REALTORS PRIVATE LIMITED,Bangalore,Active,sreenivas@dnsconsulting.net
U85300DL2017PTC313343,NICE CHOICE PRIVATE LIMITED,Delhi,Active,ashishsi011@gmail.com
U23201KA1999PTC024645,AMBIKA PETROCHEM PRIVATE LIMITED,Bangalore,Active,ROC@SHYAM-GROUP.COM
U72900DL2021PTC375961,IINKEDTECHNO IT SOLUTION PRIVATE LIMITED,Delhi,Active,dheerajvermaphm@gmail.com
U35914PN2001PTC016043,AMOGH ENGINEERS PRIVATE LIMITED,Pune,Strike Off,ashutosh.kulkarni@autolineind.com
AAU-4119,OMKAR AVAS PROPERTIES LLP,Kolkata,Active,accounts@dtcgroup.in
U85195MH1996PTC104328,ALBERT LABORATORIES PRIVATE LIMITED,Mumbai,Strike Off,-
U14102KL2014PTC037243,MARWA GRANITES PRIVATE LIMITED,Ernakulam,Active,marwagranitespvt@gmail.com
U67120MH1992PTC067980,NIRIA INVESTMENTS AND CONSULTANTS PVT.LTD.,Mumbai,Strike Off,-
U65992HR1990PTC030823,DABBU CHITS PVT. LTD.,Delhi,Strike Off,-
AAQ-3433,TRU2BUY LLP,Delhi,Active,tru2buystore@gmail.com
U74999MH2017PTC300431,MASDP EDUCATION PRIVATE LIMITED,Mumbai,Active,masdp2017@gmail.com
U72900MH2019PTC330333,USAAS INNOVATIVE TECHNOLOGY PRIVATE LIMITED,Mumbai,Active,naushire@gmail.com
U45209BR2018PTC037865,LPSPA BUSINESS SOLUTION PRIVATE LIMITED,Patna,Active,LPSPA2016@GMAIL.COM
U72900DL2012PTC236832,TEAMDECODE SOFTWARE LABS PRIVATE LIMITED,Delhi,Converted to LLP,gnagraj@teamdecode.com
U74110KA1984PTC006338,KANTU INVESTMENTS PRIVATE LIMITED,Bangalore,Converted to LLP,C1PEAK@YAHOO.CO.IN
AAU-4287,TRIPSHIP HOLIDAYS LLP,Mumbai,Active,ajinkyaambavale@yahoo.in
U51109WB2007PTC113311,PUSYA VINIMAY PRIVATE LIMITED,Kolkata,Active,pusyavinimay@gmail.com
U72900OR2006PTC008667,OM GEO-INFORMATICS& MULTIMEDIAAPPLICATIO N CEN (P) LTD,Cuttack,Strike Off,csp.ogimac@gmail.com
U55101DL2019PTC358297,DILLI KE CHATORE PRIVATE LIMITED,Delhi,Active,monu_2184@ymail.com
U45200JH2012PTC000135,GYANMOTI CONTRACTORS PRIVATE LIMITED,Jharkhand,Active,mpsamiti.bad@gmail.com
U65910MH1997PTC108824,PRATINIDHI LEASING AND FINANCE PRIVATE LIMITED,Mumbai,Strike Off,-
AAT-1977,ORNATA AI TECH LLP,Chennai,Active,rajarajanveeramuthu@gmail.com
U28932MH1983PTC029574,PRIVILEGE DISTILLERIES PRIVATE LIMITED,Mumbai,Active,cs.privilegedistilleries@gmail.com
U74899DL1995PTC073866,ANANT SHREE SHOPPE PRIVATE LIMITED,Delhi,Active,dr.anandmittal@yahoo.com
U63030OR2020PTC034402,SELF RIDES PRIVATE LIMITED,Cuttack,Active,naynuku.panda@gmail.com
U70200TN2013PTC091908,TULIA INFRASTRUCTURES PRIVATE LIMITED,Chennai,Strike Off,gerald.arokiaraj@gmail.com
U01403AP2014PTC095497,INDO UK AGRI SEEDS PRIVATE LIMITED,Vijayawada,Active,sridharmannam84@gmail.com
U74999KL2017PTC048385,SAFEGLAZE PRIVATE LIMITED,Ernakulam,Strike Off,rinto_008@me.com
U50500TN2018PTC126615,TRANSWORLD E CYCLES PRIVATE LIMITED,Chennai,Active,ikrohit@choosemybicycle.com
U08031KA1993PTC013954,MUTUAL FRIENDS INVESTMENTS PRIVATE LIMIT ED,Bangalore,Strike Off,-
U50401GJ2019PTC109912,KARNAVATI WHEELS PRIVATE LIMITED,Ahmedabad,Active,karnavatiwheels@gmail.com
U74993JH2018PTC011299,WHZBUILDTECH PRIVATE LIMITED,Jharkhand,Active,manish.msyadav.yadav@gmail.com
U70101MH2011PTC216133,YASIR REALTIES PRIVATE LIMITED,Mumbai,Strike Off,info@rohangroup.com
AAZ-7768,WORLDHIGH INNOVATIONS LLP,Ahmedabad,Active,worldhighinnovationsllp@gmail.com
U74999AS2018PTC018661,TIMSI PHARMA INDIA PRIVATE LIMITED,Shillong,Active,rumi.borah@gmail.com
U63032UP2022PTC160009,KAVERY TOURIST SERVICES PRIVATE LIMITED,Kanpur,Active,hrlmkg@gmail.com
U72900TN2021PTC143478,KREYOSOFT TECHNOLOGIES PRIVATE LIMITED,Chennai,Active,info@all4rentz.com
U74140DL1995PLC069585,LAZARD ENGINEERING AND CONSULTANT LIMITED,Delhi,Under Process of Striking Off,-
U74999RJ2018PTC059923,DONE TRIP PRIVATE LIMITED,Jaipur,Active,nprakash0602@gmail.com
U74310KA1984PTC006485,CHAITANYA MARKETINGANDCONSULTANTS PRIVAT E LIMITED,Bangalore,Strike Off,-
U31909TG1990PTC011743,PENGUIN ELECTRICALS PRIVATE LIMITED,Hyderabad,Strike Off,-
U52609MH2017PTC293235,POLARITAS TECHNOLOGIES PRIVATE LIMITED,Mumbai,Active,maheshmgala_ca@yahoo.co.in
U17110MH1995PLC085389,MARUTI FERRO-TECH LIMITED,Mumbai,Dormant under section 455,laad@khadkeshwara.com
U51101WB2010PTC143831,KLENZER DISTRIBUTORS PRIVATE LIMITED,Kolkata,Active,ankitdealtrade@rediffmail.com
U45201PN2004PTC019118,SOHAM PROJECTS PRIVATE LIMITED,Pune,Active,jas30sam@gmail.com
U24200GJ2019PTC106950,ADINATH BRINE CHEM PRIVATE LIMITED,Ahmedabad,Active,DEEPAK@OSWALLUMBERS.COM
U74899DL2003PTC122081,TIMES POLYMERS PRIVATE LIMITED,Delhi,Active,timespolymers@gmail.com
U01100MH2022PTC374804,PADOLIKAR A ZP FARMERS PRODUCER COMPANY LIMITED,Mumbai,Active,padolikarzpfpo@gmail.com
U72900MH2010PTC207652,STAND POINT IT SERVICES PRIVATE LIMITED,Mumbai,Active,spitspl@gmail.com
U72900KL2015PTC039356,SYSBRICK TECHNOLOGIES PRIVATE LIMITED,Ernakulam,Active,bineeshtvr@gmail.com
U70109UP2016PTC082778,AKSHANSH BUILDWELL PRIVATE LIMITED,Kanpur,Strike Off,VIRENDRA19760403@GMAIL.COM
AAJ-2093,AYUSYAM INSURANCE MARKETING LLP,Mumbai,Strike Off,manishsawant@gmail.com
U72900KA2019PTC125403,YUVANSH TECHNOLOGIES PRIVATE LIMITED,Bangalore,Active,thippesh2006@yahoo.com
U22219WB2003PTC095990,PRESSCO PRINTS & PACKAGING PRIVATE LTD,Kolkata,Active,skroy58@gmail.com
U24234UP2004PTC028598,PUSHP BIO CHEM PRIVATE LIMITED,Kanpur,Strike Off,gunjangarg@rediffmail.com
U99999DL1998PTC093581,BRICE AND RUTH DOUGLAS NETWORK MANAGEMEN T PRIVATE LTD.,Delhi,Strike Off,-
U65910UP1992PLC014459,R.N. GRAMIN KRISHI FINANCE LIMITED,Kanpur,Strike Off,-
U90000KL2014PTC037406,AQUALITIX NATURAL BIOTICS PRIVATE LIMITED,Ernakulam,Strike Off,john@hlbhamt.com
U72200HR2011PTC056403,QUADRANT INFOSOFT PRIVATE LIMITED,Delhi,Amalgamated,kiranduggal10@yahoo.com
U74900MH2014PTC252850,VIJAYA SUPPORT MANAGEMENT PRIVATE LIMITED,Mumbai,Strike Off,rakeshgshenoy@yahoo.co.in
U99999MH1936PTC002554,NEW ERA ARTISTS LIMITED,Mumbai,Dissolved,-
U99999DL1981PTC019366,DHAWAN STAGE CRAFTS PVT LTD,Delhi,Active,-
U24294TN1993PTC024517,RANG RASAYAN ASSOCIATES PRIVATE LIMITED,Chennai,Active,rrapltd@rediffmail.com
U74999TN2017PTC117220,AVM GENERAL TRADING INDIA PRIVATE LIMITED,Chennai,Active,info@avmgt.in
U50300PB2006PTC029862,STAR VEHICLES PRIVATE LIMITED,Chandigarh,Strike Off,MOHITMEHAR@GMAIL.COM
AAC-0393,HERITAGE LIFESTYLES LIMITED LIABILITY PA,Mumbai,Active,heritagelifestyles@gmail.com
U26943RJ1995PTC010859,YASH CEMENT PVT LTD,Jaipur,Strike Off,-
U74999UP2018PTC111478,ACM PRODUCTIONS PRIVATE LIMITED,Kanpur,Active,suneetthakur97@gmail.com
AAP-3506,DR.HAIRMAGICA HAIR TRANSPLANT & AESTHETI,Pune,Active,drishtibd15@gmail.com
U72900DL2013PTC255704,RED ANTS SERVICES PRIVATE LIMITED,Delhi,Strike Off,harish.cs1983@gmail.com
U01100WB2017PTC223357,RANIBANDH JANABIKASH FARMERS PRODUCER COMPANY LIMITED,Kolkata,Under Process of Striking Off,bsaren1992@gmail.com
U45200OR2013PTC017409,ICARUS INFRASTRUCTURE PRIVATE LIMITED,Cuttack,Active,cfc@smaodisha.com
U85310BR2018PTC037075,CUTICULAR MEDICAL PRIVATE LIMITED,Patna,Active,neeraj_merchant@rediffmail.com
AAD-9004,MOTHER FACILITY MANAGEMENT SERVICES LLP,Pune,Active,priyankaganeshgangurde@gmail.com
U65910UP1993PLC015230,SANDAL INDIA SAVINGS AND INVESTMENT LIMITED,Kanpur,Strike Off,-
U72200DL2006FTC286212,BERKELEY DESIGN AUTOMATION INDIA PRIVATE LIMITED,Delhi,Amalgamated,info_india@mentor.com
U40106DL2011PLC220899,JPM POWER AND MINERALS LIMITED,Delhi,Amalgamated,jpmmineral@gmail.com
U01400MH2008PTC183124,APRICOT FARMS PRIVATE LIMITED,Mumbai,Converted to LLP and Dissolved,dsplmca@servicesnext.com
U73100PN2007PTC130478,ACCELAIRE CONSULTING & RESEARCH PRIVATE LIMITED,Pune,Strike Off,devendracs@gmail.com
U63040KL2007PTC021553,COSYCOAST LAND TOURS AND TRAVELS PRIVATE LIMITED,Ernakulam,Strike Off,gands@sify.com
U15400MH2020PTC352318,ORB SPICES PRIVATE LIMITED,Mumbai,Active,ashish.inamdar@outlook.com
U65992KL2000PTC014293,DEVAPRASTHAM CHITS PRIVATE LIMITED,Ernakulam,Strike Off,jpanchery@sify.com
U65991TN1994PLC029113,ARUDHRA BENEFIT FUND LIMITED,Chennai,Strike Off,shreyas_cbm@yahoo.com
U51909WB2012PTC177861,SNOWBALL TIE-UP PRIVATE LIMITED,Kolkata,Strike Off,sumitg.cal89@gmail.com
U74999MH2017FTC301559,TRAFALGAR SHIPPING (IND) PRIVATE LIMITED,Mumbai,Active,kotak.r.deepak@gmail.com
U72300UP2000PTC025587,DIGITAL INFORMATICS PRIVATE LIMITED,Kanpur,Active,digitalgautamsaxena@gmail.com
U74300RJ2011PTC035547,INNATE INFOMEDIA PRIVATE LIMITED,Jaipur,Strike Off,jay_gautam@yahoo.com
U51900MH1985PTC037636,PRANAVADITYA TEXTILE PRIVATE LIMITED,Mumbai,Strike Off,pt_pawar@hotmail.com
U22130TG2007PTC056899,RISHI AD-MEDIA INDIA PRIVATE LIMITED,Hyderabad,Strike Off,HARIPRASADD@HOTMAIL.COM
U01100PN2020PTC195219,WADULE FARMERS PRODUCER COMPANY LIMITED,Pune,Active,laxmanavhad01@gmail.com
U74999DL2012PTC243899,CS INNOVATIONS PRIVATE LIMITED,Delhi,Strike Off,gautamwalia.cs@gmail.com
U45206TN2013PTC094376,AMR CONSTRUCTIONS AND DEVELOPERS PRIVATE LIMITED,Chennai,Strike Off,rahman345@gmail.com
U70101UP2006PTC031784,ALAIPURIA FOOD AND COLD STORAGE PRIVATE LIMITED,Kanpur,Active,afcspl787@gmail.com
U63030KA2018PTC119116,ABCD R-LIFE PRIVATE LIMITED,Bangalore,Active,baanaaravimobiles@gmail.com
U18202TG2019PTC133234,VEERADHA LIFESTYLE PRIVATE LIMITED,Hyderabad,Active,veerayya@hotmail.com
U52399MH2010PTC203725,WESTLINK TRADING PRIVATE LIMITED,Mumbai,Active,ms.westlink@rediffmail.com
U85110DL2004PTC125895,SUSHEELA MEDICAL AND RESEARCH CENTRE PRIVATE LIMITED,Delhi,Strike Off,ARVINDADV1@YAHOO.COM
U74999DL2010PTC201492,ROCKSTAR MULTIBUSINESS SOLUTIONS PRIVATE LIMITED,Delhi,Strike Off,JIYA91980@GMAIL.COM
U72900DL2014PTC267992,SR3 EXCELLENCE SOLUTIONS PRIVATE LIMITED,Delhi,Strike Off,rajpathak38@gmail.com
U74999TN2018PTC120750,BLOOM SPORTS AND FITNESS STUDIO PRIVATE LIMITED,Chennai,Active,lakshmanan@wearerush.in
U74999WB2017PTC223903,UDAY AYURVEDIC PRODUCTS PRIVATE LIMITED,Kolkata,Active,udayshankarprasad187@gmail.com
U93000TN2016NPL110703,STARTUP NUKAD INDIA FOUNDATION,Chennai,Active,accounts@icegen.net
U51909WB2012PTC172658,GOODPOINT DISTRIBUTORS PRIVATE LIMITED,Kolkata,Strike Off,goodpoint.dis2012@gmail.com
U74999MH2018PTC305303,PIMA PROPERTIES PRIVATE LIMITED,Mumbai,Active,pimapropertiespvt.ltd@gmail.com
U51109DL1991PTC043963,MANJIT OVERSEAS PRIVATE LIMITED,Delhi,Strike Off,-
U51909WB2011PTC171526,SUBHREKHA DISTRIBUTORS PRIVATE LIMITED,Kolkata,Strike Off,incometaxfilling.ofc9@gmail.com
U45400MH2015PTC270469,QUANTUM TECH BUILDING SOLUTIONS PRIVATE LIMITED,Mumbai,Active,irshetty@rediffmail.com
U52520MH2022PTC374255,BME CARE PRIVATE LIMITED,Mumbai,Active,sandeeppillaig88@gmail.com
U60231MP2019PTC048230,AIRMAN LOGISTICS INDIA PRIVATE LIMITED,Gwalior,Active,manjuransari15@gmail.com
U67120WB1995PTC220459,CHANDLAS SECURITIES PRIVATE LIMITED,Kolkata,Active,rojaramanij@yahoo.in
U45400TG2007PTC055489,KUBER REALTY PROPERTIES INDIA PRIVATE LIMITED,Hyderabad,Active,admin@rsbajaj.co.in
U31909DL2002PTC116895,GIRISH SWITCHES PRIVATE LIMITED,Delhi,Active,accounts.girish@yahoo.com
U31900MH2007PTC169246,SUPERLITE LIGHTING COMPANY PRIVATE LIMTED,Mumbai,Active,info@superliteindia.com
U24231OR1985PTC001500,PIYUSH CHEMICALS AND PHARMACEUTICALS PVT LTD,Cuttack,Strike Off,-
U22300TN2022PTC148995,ESTILO BOOKS PRIVATE LIMITED,Chennai,Active,ramjee9@gmail.com
U35117GJ1995PTC026248,RIPPEN RADIATORS AND HEAT EXCHANGERS PRIVATE LIMITED,Ahmedabad,Active,rippen2002@gmail.com
U65993DL1997PTC084518,RNG FINVEST PRIVATE LIMITED,Delhi,Active,pankajmittal@starfinvest.in
AAM-8456,INTERHOSPITALITY LLP,Delhi,Active,abhishekvedandco@gmail.com
U24231UP1997PTC021667,TIMES DRUGS AND PHARMACETICALS PRIVATE LIMITED,Kanpur,Active,times_drugs@yahoo.co.in
U67120MH1995PTC084318,MUDRA COMMODITY AND DERIVATIVES PRIVATE LIMITED,Mumbai,Active,mudracommodity@gmail.com
U73100UP2020PTC128990,PHARMA INSTINCT PRIVATE LIMITED,Kanpur,Active,rajeshsehgal1@rediffmail.com
U72900UP2021PTC146080,OCTTER AI INFOSOLUTIONS PRIVATE LIMITED,Kanpur,Active,octterai@gmail.com
U72200DL2001PTC111903,ITELLI SENSE PVT LTD,Delhi,Strike Off,spa1000@gmail.com
U24231TN1992PTC023659,HERBONAT PHARMA PRIVATE LIMITED,Chennai,Strike Off,-
AAP-4019,INSCULPT TECHNOLOGIES LLP,Pune,Active,mechwork24@gmail.com
U51109BR2010PTC015178,EASYWAY DISTRIBUTORS PRIVATE LIMITED,Patna,Strike Off,avinash280991@rediffmail.com
U20231TN2012PTC085326,CORPORATE CONCEPTS INFRA PRIVATE LIMITED,Chennai,Active,durai@indohgroup.com
U74999PN2018PTC177579,REWAGO MANAGEMENT SOLUTIONS PRIVATE LIMITED,Pune,Active,rewaskar.ad@gmail.com
U74999WB2012PTC182603,K C AGARWAL MERCHANTS PRIVATE LIMITED,Kolkata,Active,manoj.agarwal786@gmail.com
U74999KA2017PTC106173,DIGIMECH ENERGY SOLUTIONS PRIVATE LIMITED,Bangalore,Active,sirasrinivasa1984@gmail.com
U18209TN1992PLC023657,TNT INDUSTRIES LIMITED,Chennai,Strike Off,-
U26943RJ1991PTC005992,DHANUKA CEMENTS PVT.LTD.,Jaipur,Strike Off,-
AAM-2443,LIFE RMC PLANT LLP,Mumbai,Active,jagdish@kargwal.com
U60210GJ2004PTC044076,OKHAWALA ROAD LINES PRIVATE LIMITED,Ahmedabad,Strike Off,chetan_fca@yahoo.co.in
U45200TN2010PTC074896,SRI RAMANA BUILDING CONSTRUCTIONS PRIVATE LIMITED,Chennai,Active,engineergandhi@gmail.com
U25199TG1998PTC029992,INDUPRIYA MOULDS AND PLASTICS PRIVATE LI MITED,Hyderabad,Strike Off,-
U51900KL2015PTC039514,ITALCO CERAMICA PRIVATE LIMITED,Ernakulam,Active,marketing@italco.in
AAR-9521,INDUSTECH CONSULTANCY LLP,Mumbai,Active,mugtannim@gmail.com
U92142RJ2012PTC038873,MANISH EVENTS PRIVATE LIMITED,Jaipur,Strike Off,skhorania@yahoo.co.in
U25199TG1988PTC009223,SANRAJ RUBBER PRODUCTS PVT LTD.,Hyderabad,Strike Off,-
AAH-4576,DELNET CONNECT LLP,Delhi,Active,geetu.agg@gmail.com
U74999TN2018PTC126252,SRI ARUNACHALESWARA HERBAL CARE PRIVATE LIMITED,Chennai,Active,palanilakshmi673@gmail.com
U52110TZ2000PTC009137,CUFA INTERIORS AND MARKETING PRIVATE LIMITED,Coimbatore,Strike Off,-
U85191TG2010PTC071660,AMRUTHA MULTI SPECIALITY HOSPITAL PRIVATE LIMITED,Hyderabad,Strike Off,CARAMESH468@GMAIL.COM
U51310TZ2010PTC016179,NICK PHILS CLOTHING PRIVATE LIMITED,Coimbatore,Strike Off,baronintellect@yahoo.com
U55101RJ2008PTC026440,ARAVALI RETREAT PRIVATE LIMITED,Jaipur,Strike Off,ajay@srgoyal.com
AAA-0053,KIDOLOGY DESIGN (INDIA) LLP,Delhi,Strike Off,dvacs@aol.in
U18209UP2017PTC091998,DIVINE COUNT CREATIONS PRIVATE LIMITED,Kanpur,Active,infopurwar@gmail.com
U24290MH2021PTC365874,PRAECLARUM RESEARCH AND HEALTHCARE PRIVATE LIMITED,Mumbai,Active,Praeclarum.r.h@gmail.com
U26100PN2021PTC200538,SAIKIRAN GLASS INDUSTRIES PRIVATE LIMITED,Pune,Active,ADWAIT@AVBCO.IN
U51900MH2008PTC178976,NYASA ENTERPRISES PRIVATE LIMITED,Mumbai,Active,nyasa.cilantro@gmail.com
U65992DL2009PTC188210,PETALS CHIT FUND PRIVATE LIMITED,Delhi,Strike Off,vkbvkb168@hotmail.com
U72200TG2019PTC134088,HLR SOLUTIONS PRIVATE LIMITED,Hyderabad,Active,hlrsolutions369@gmail.com
U55101RJ2008PTC026635,RAJASTHAN PARADISE RESORTS PRIVATE LIMITED,Jaipur,Strike Off,sunita_fcs@rediffmail.com
U15490WB2020PTC241286,PRISOVO CRYSTAL FOOD PRIVATE LIMITED,Kolkata,Active,legal@crystalwindow.org
U72400KA2013PTC070262,MINT LABS PRIVATE LIMITED,Bangalore,Strike Off,devaraj@devbvca.com
U51420MH2005PTC156397,TIRUPATI COMMODITIES IMPEX PRIVATE LIMITED,Mumbai,Active,info@tiipl.com
U92490HR2019PTC083274,BLISSFUL PLANS EVENTS AND MEDIA PRIVATE LIMITED,Delhi,Active,pooja.blissfulplans@gmail.com
U72200AP2015PTC097057,YELLOWDOT IT SOLUTIONS PRIVATE LIMITED,Vijayawada,Strike Off,harikrishnaannepu001@gmail.com
U74900PN2011PTC141769,LEXCODE REGULATORY COMPLIANCE TECHNOLOGIES PRIVATE LIMITED,Pune,Active,shuchinagpal@gmail.com
U74899DL1949PTC001621,MAXO LABORATORIES PRIVATE LTD,Delhi,Active,maxolab@gmail.com
U74999WB2017PTC223811,M.R. ALLIANCE PRIVATE LIMITED,Kolkata,Active,skzr786@gmail.com
U24303KA2017OPC099348,NANDISHWARA ORGANIC AND AYURVEDIC PRODUCTS (OPC) PRIVATE LIMITED,Bangalore,Active,shashidharmedur@gmail.com
U74910TG2012PTC079230,GLOBALSENA CONSULTANCY PRIVATE LIMITED,Hyderabad,Active,mohan@globalsena.com
U34300DL2005PTC136379,JAPMEET MOTORS PRIVATE LIMITED,Delhi,Strike Off,nkishwar.company@gmail.com
U92490TG2021PTC156808,SCIENTIA MEETINGS PRIVATE LIMITED,Hyderabad,Active,venkateshkothapally0302@gmail.com
U72900TG2016PTC110494,IKAYA SOLUTIONS PRIVATE LIMITED,Hyderabad,Active,pradeep.brp@gmail.com
U45200BR2016PTC025667,SWARN GIRI CONSTRUCTION PRIVATE LIMITED,Patna,Under Process of Striking Off,kumarisneha234@gmail.com
U45201PN1993PTC070359,LIQUID GOLD CONSTRUCTIONS PVT LTD,Pune,Strike Off,-
AAQ-1033,MATER DEI BUSINESS VENTURES LLP,Ernakulam,Under Process Of Strike Off,amit.paius@gmail.com
U70101WB2000PTC091503,INFRASTRUCTURE ENGINEERS INDIA PRIVATE L IMITED,Kolkata,Strike Off,palroyca@gmail.com
U92100TG2013PTC088286,Z-DEPTH TECHNOLOGIES PRIVATE LIMITED,Hyderabad,Strike Off,GOKHALEANDCO@GMAIL.COM
U17299UP2021OPC150583,TWARIT INDUSTRIES (OPC) PRIVATE LIMITED,Kanpur,Active,s.t.shiv.98@gmail.com
U61100MH2017PTC293770,GPS MARINE SERVICES PRIVATE LIMITED,Mumbai,Active,shrutimarines@gmail.com
U67100WB2018PTC227907,RASHMONI FOREX & TRAVELS PRIVATE LIMITED,Kolkata,Active,mca1969@gmail.com
U70109WB2012PTC175055,ARYADEEP REALESTATES PRIVATE LIMITED,Kolkata,Active,aryadeepreal@gmail.com
U74900MH2010PTC203733,VISION INKS AND RESINS PRIVATE LIMITED,Mumbai,Active,visioninksltd@gmail.com
U55209WB2019PTC231786,DAILYPLATTERS FOODS PRIVATE LIMITED,Kolkata,Active,soumiksantra1990@gmail.com
U70101MH1990PTC056436,SHREERAM FOUNDATIONS PRIVATE LIMITED,Mumbai,Strike Off,-
U99999MH1958PTC010129,ORIENTAL MOVIES LTD,Mumbai,Active,-
U70101MH1997PTC109824,SANGAM CITY TOWNSHIP PRIVATE LIMITED,Pune,Active,SECRETARIAL@PANCHSHIL.COM
U51397TN2007PTC065015,CYNOSURE ORGANICS PRIVATE LIMITED,Chennai,Strike Off,sriniacs@gmail.com
U74999PN2016PLC166180,PT INDUSTRIES (I) LIMITED,Pune,Active,suneet@ptindustriesltd.com
U74999TG2019PTC131457,SNEHA ENTERPRISES [HYD] PRIVATE LIMITED,Hyderabad,Active,amargca@gmail.com
AAL-4463,MANIFEST ENGINEERING LIMITED LIABILITY P,Mumbai,Active,hr1@macpl.com
U72900UP2017PTC095080,DAAIOTA INFOTECH PRIVATE LIMITED,Kanpur,Strike Off,contact@daaiota.com
U24110UP2020PTC136237,STARLIFE REMEDIES PRIVATE LIMITED,Kanpur,Active,ROCEFILING2018@GMAIL.COM
U72200TN2011PTC079299,TRIESTEN INFOTECH PRIVATE LIMITED,Chennai,Strike Off,sriram@triesten.com
U70100DL2011PTC228918,SHINE PROPBUILD PRIVATE LIMITED,Delhi,Converted to LLP,umeshkapoor@hotmail.com
U17111WB1997PTC085496,SENORITA CREATIONS PRIVATE LIMITED,Kolkata,Active,accounts@sareez.com
U72900RJ2020PTC070779,GOLDEN AND GRAND OPPORTUNITY PRIVATE LIMITED,Jaipur,Active,goldengrandopportunity@gmail.com
U72200TG2018PTC128094,NOTHING BUT CODE PRIVATE LIMITED,Hyderabad,Active,SIDDULR@YAHOO.COM
U74899DL1981PTC012891,BAHINDCAN TRADING COMPANY PRIVATE LIMITED,Delhi,Active,tripathirishi1@gmail.com
U74140MH2000PTC125526,EMFI ADVISORS PRIVATE LIMITED,Mumbai,Active,sanjayamritlalca@rediffmail.com
U27100KL2020PTC064918,BOBY CHEMMANUR ENTERPRISES PRIVATE LIMITED,Ernakulam,Active,cs2@chemmanurinternational.com
U72200TN2006PTC059717,ENVISION SOFTWARE ENGINEERING PRIVATE LIMITED,Chennai,Active,sankar@isnetusa.com
U74999DL2020PTC365419,V NEXT VENTURES PRIVATE LIMITED,Delhi,Active,kapil_pandey@yahoo.com
AAZ-2383,SHRIARA AUTOMOTIVE LLP,Kanpur,Active,lalit@happyeasyrides.com
U01100HR2020PTC089152,DIGAGRO PRIVATE LIMITED,Delhi,Active,gaud.bp@gmail.com
U16009DL2018PTC335178,ECSTATIC TOBACCO MANUFACTURER PRIVATE LIMITED,Delhi,Strike Off,njainfca@yahoo.co.in
U63040TN2010PTC075113,JINKORP INTERNATIONAL TRAVEL SERVICES PRIVATE LIMITED,Chennai,Strike Off,bjindal@jinkorp.com
AAR-0485,WELKIN CONSERVATION LLP,Ahmedabad,Active,info@welkin.org.in
